<?xml version="1.0" encoding="UTF-8" ?>
<candies xmlns:xsi="http://www.w3.org/2001/XMLSchema-instance"
         xmlns="http://www.training.by/candies"
         xsi:schemaLocation="http://www.training.by/candies candies.xsd">
    <candy barcode="Code-2220069001079">
        <candyName>Птичье молоко</candyName>
        <chocolate isWrapped="true" isGlazed="true">
            <glaze>Глазурь шоколадная</glaze>
            <body>Со сбивным корпусом</body>
        </chocolate>
        <composition>
            Шоколадная глазурь(сахар, какао тертое, какао-масло, эмульгатор
            лецитин; ароматизатор, идентичный натуральному, "Ваниль"), сахар,
            патока, масло из коровьего молока, молоко цельное сгущенное с
            сахаром, белок яичный сухой, желеобразователь агар, регулятор
            кислотности кислота лимонная; ароматизатор, идентичный натуральному,
            ванилин.
        </composition>
        <manufactureDate>2019-08-25</manufactureDate>
        <shelfLife measure="months">6</shelfLife>
        <producer>
            <producerName>СОАО "Коммунарка"</producerName>
            <address>
                <country>Республика Беларусь</country>
                <postcode>220033</postcode>
                <city>Минск</city>
                <street>Аранская</street>
                <building>18</building>
            </address>
        </producer>
        <nutritionalValue>
            <proteins>2.60</proteins>
            <fats>24.40</fats>
            <carbohydrates>55.80</carbohydrates>
            <energy>44</energy>
        </nutritionalValue>
    </candy>
    <candy barcode="Code-2220069001482">
        <candyName>Осень</candyName>
        <chocolate isWrapped="true" isGlazed="true">
            <glaze>Глазурь жировая</glaze>
            <body>C помадным корпусом</body>
        </chocolate>
        <composition>
            Cахар, жировая глазурь(сахар, жир кондитерский,какао порошок),
            молоко цельное сгущенное с сахаром, патока, какао-порошок, спирт
            этиловый ректификованный не ниже высшей очистки, ферментный препарат
            инвертаза.
        </composition>
        <manufactureDate>2019-08-29</manufactureDate>
        <shelfLife measure="months">4</shelfLife>
        <producer>
            <producerName>СОАО "Коммунарка"</producerName>
            <address>
                <country>Республика Беларусь</country>
                <postcode>220033</postcode>
                <city>Минск</city>
                <street>Аранская</street>
                <building>18</building>
            </address>
        </producer>
        <nutritionalValue>
            <proteins>4.40</proteins>
            <fats>13.50</fats>
            <carbohydrates>71.10</carbohydrates>
            <energy>413</energy>
        </nutritionalValue>
    </candy>
    <candy barcode="Code-4607134380501">
        <candyName>Миндаль в молочной шоколадной глазури</candyName>
        <chocolate isWrapped="true" isGlazed="true">
            <glaze>Глазурь шоколадная</glaze>
            <body>С ореховой начинкой</body>
        </chocolate>
        <composition>
            Молочная шоколадная глазурь (сахар, эквивалент какао масла, какао
            тертое, какао порошок, молоко сухое обезжиренное, эмульгатор-лецитин,
            ароматизатор идентичный натуральному ванильный), ядро ореха миндаля
            цельное жареное, глазирователь "Квик"
        </composition>
        <manufactureDate>2019-08-29</manufactureDate>
        <shelfLife measure="months">6</shelfLife>
        <producer>
            <producerName>ООО "Сладкий Орешек"</producerName>
            <address>
                <country>Россия</country>
                <postcode>141554</postcode>
                <region>Московская область</region>
                <district>Солнечногорский район</district>
                <village>Мелечкино</village>
                <building>123</building>
            </address>
        </producer>
        <nutritionalValue>
            <proteins>9.30</proteins>
            <fats>44.70</fats>
            <carbohydrates>42.50</carbohydrates>
            <energy>560</energy>
        </nutritionalValue>
    </candy>
    <candy barcode="Code-4607134380990">
        <candyName>Марсианка</candyName>
        <chocolate isWrapped="true" isGlazed="true">
            <glaze>Глазурь жировая</glaze>
            <body>С кремовым корпусом</body>
        </chocolate>
        <composition>
            Заменитель какао масла, какао порошок, сахар, сухое обезжиренное
            молоко, рис воздушный, ванилин, лецитин, ароматизатор идентичный
            натуральному, глазирователь квик.
        </composition>
        <manufactureDate>2019-08-29</manufactureDate>
        <shelfLife measure="months">6</shelfLife>
        <producer>
            <producerName>ООО "Сладкий Орешек"</producerName>
            <address>
                <country>Россия</country>
                <postcode>141554</postcode>
                <region>Московская область</region>
                <district>Солнечногорский район</district>
                <village>Мелечкино</village>
                <building>123</building>
            </address>
        </producer>
        <nutritionalValue>
            <proteins>2.50</proteins>
            <fats>14.20</fats>
            <carbohydrates>63.80</carbohydrates>
            <energy>375</energy>
        </nutritionalValue>
    </candy>
    <candy barcode="Code-2220069001383">
        <candyName>Рябиновая роща</candyName>
        <chocolate isWrapped="true" isGlazed="true">
            <glaze>Глазурь шоколадная</glaze>
            <body>С желейной начинкой</body>
        </chocolate>
        <composition>
            Cахар, пюре яблочное, шоколадная глазурь(сахар, какао тертое,
            какао-масло, эмульгатор лецитин; ароматизатор, идентичный
            натуральному,"Ваниль"), пюре черноплодной рябины, желеобразователь
            пектин, регулятор кислотности кислота лимонная; ароматизатор,
            идентичный натуральному "Барбарис".
        </composition>
        <manufactureDate>2019-08-29</manufactureDate>
        <shelfLife measure="months">5</shelfLife>
        <producer>
            <producerName>СОАО "Коммунарка"</producerName>
            <address>
                <country>Республика Беларусь</country>
                <postcode>220033</postcode>
                <city>Минск</city>
                <street>Аранская</street>
                <building>18</building>
            </address>
        </producer>
        <nutritionalValue>
            <proteins>1.20</proteins>
            <fats>8.80</fats>
            <carbohydrates>74.90</carbohydrates>
            <energy>358</energy>
        </nutritionalValue>
    </candy>

    <candy barcode="Code-4605516004656">
        <candyName>Сорока Белобока</candyName>
        <caramel isWrapped="true" isGlazed="false">
            <grade>Карамель с начинкой</grade>
            <processingMethod>Карамель с тянутой оболочкой – непрозрачная</processingMethod>
        </caramel>
        <composition>
            Сахар, патока, ядро подсолнечника тертое, вода питьевая, продукт
            экструдированных круп ржаной, ароматизатор «Ванильный», красители:
            Е150с, Е120; антиокислитель аскорбиновая кислота. Возможно наличие
            незначительного количества арахиса, продуктов переработки молока.
        </composition>
        <manufactureDate>2019-08-25</manufactureDate>
        <shelfLife measure="months">9</shelfLife>
        <producer>
            <producerName>ОАО «Воронежская кондитерская фабрика»</producerName>
            <address>
                <country>Россия</country>
                <postcode>394030</postcode>
                <city>Воронеж</city>
                <street>Кольцовская</street>
                <building>40</building>
            </address>
        </producer>
        <nutritionalValue>
            <proteins>3.50</proteins>
            <fats>3.50</fats>
            <carbohydrates>84.00</carbohydrates>
            <energy>420</energy>
        </nutritionalValue>
    </candy>
    <candy barcode="Code-2220118003269">
        <candyName>Фрукты-ягодки</candyName>
        <caramel isWrapped="true" isGlazed="false">
            <grade>Леденцовая карамель</grade>
            <processingMethod>Карамель с нетянутой оболочкой – стеклообразная</processingMethod>
        </caramel>
        <composition>
            Сахар, патока, вода питьевая, регулятор кислотности – лимонная
            кислота, растительный экстракт «Яблоко», ароматизаторы: «Лимон»,
            натуральные «Апельсин», «Вишня», красители Е120, Е100, Е160с, Е141.
        </composition>
        <manufactureDate>2019-08-29</manufactureDate>
        <shelfLife measure="months">15</shelfLife>
        <producer>
            <producerName>ООО «Объединенные кондитеры»</producerName>
            <address>
                <country>Россия</country>
                <postcode>115184</postcode>
                <city>Москва</city>
                <street>2-ой Новокузнецкий пер., 13/15</street>
                <building>1</building>
            </address>
        </producer>
        <nutritionalValue>
            <proteins>0.00</proteins>
            <fats>0.00</fats>
            <carbohydrates>96.00</carbohydrates>
            <energy>380</energy>
        </nutritionalValue>
    </candy>
    <candy barcode="Code-2220069001604">
        <candyName>Молочная</candyName>
        <caramel isWrapped="true" isGlazed="false">
            <grade>Карамель с начинкой</grade>
            <processingMethod>Карамель с тянутой оболочкой – непрозрачная</processingMethod>
        </caramel>
        <composition>
            Сахар, патока,молоко цельное сгущенное с сахаром, концентратквасного
            сусла, маргарин; ароматизатор, идентичный натуральному, "Ром".
        </composition>
        <manufactureDate>2019-08-29</manufactureDate>
        <shelfLife measure="months">6</shelfLife>